{
  "schemaVersion": 1,
  "gameVersion": "11.19.0.10",
  "executableSha256": "1cda5c31919c9784a41bee7f3270ec1b4536b124c51e8b36f2221b381760307d",
  "discoveredAtUtc": "2026-08-02T20:30:00Z",
  "offsets": {
    "replayTime": 0,
    "playerHP": 0,
    "playerPositionX": 0,
    "playerPositionY": 0,
    "playerPositionZ": 0,
    "playerYaw": 0,
    "cameraPitch": 0,
    "aliveTankCount": 0
  },
  "fieldValidation": {
    "playerYaw": {
      "status": "Stale",
      "evidence": [
        {
          "provenanceKind": "StaticAnalysis",
          "sourceTool": "Ghidra 12.1.2 \u2014 FindOffsets.java",
          "notes": "Historical hypothesis quarantined after reconciliation: prior table decimal 51808784 = 0x03168A10; prior notes claimed 0x0317A810 = 51882000; raw export top candidate was 56085200 = 0x0357CAD0. No dynamic verification or address-kind proof."
        }
      ],
      "independentProcessLaunches": 0,
      "independentReplays": 0,
      "harnessInvariantsPassed": false,
      "leadApproved": false,
      "decoderAuditorApproved": false
    },
    "playerPositionX": {
      "status": "Unknown",
      "evidence": [
        {
          "provenanceKind": "DynamicScan",
          "sourceTool": "GameHarness loopback discover-snapshot/compare + discover/pattern",
          "notes": "OD-RECOVERY-004/005/006: controlled offline A->B Float32 [-500,500] narrowing over bounded private/mapped windows; returned candidates addressKind=private-mapping (heap-dynamic pending root). No module-rva/member/pointer-chain root; absolute addresses and values not published."
        },
        {
          "provenanceKind": "GameHarness",
          "sourceTool": "WotBTreader.GameHarness / Host.Web gated scanner",
          "notes": "Sessions discarded after aggregate compare; independentProcessLaunches/Replays remain 0 for promotion. Soft-capped MaxBytes available as of 2026-08-02."
        },
        {
          "provenanceKind": "DynamicScan",
          "sourceTool": "Host.Web discover/pattern ImageRegionsOnly",
          "notes": "OD-RECOVERY-007: 12/12 image-only little-endian absolute pointer AOBs for returned private-mapping survivors returned zero hits. Rules out direct MEM_IMAGE storage of those absolute pointers for this sample; does not promote any offset."
        },
        {
          "provenanceKind": "DynamicScan",
          "sourceTool": "Host.Web discover/pattern absolute LE pointer matrix + CE 7.7 smoke",
          "notes": "OD-RECOVERY-008: windowed Float A->B private-mapping survivors; absolute LE pointer AOB across private/all/image and align 1/8 returned 0 hits; CE x64 launched under OfflineReplayVerified without automated attach/scan. Rules out repeating absolute LE pointer AOB unchanged; does not promote any offset."
        },
        {
          "provenanceKind": "DynamicScan",
          "sourceTool": "Host.Web discover/pattern truncated low32 + CE 7.x debug_setBreakpoint(bptAccess)",
          "notes": "OD-RECOVERY-009: truncated low-32 LE dword AOB of absolute survivors returned 0 hits (priv/img/all). CE attached under OfflineReplayVerified with Windows debugger and 3 access breakpoints; overlapping resume pulse produced 0 hits (no RIP module histogram). Does not promote any offset."
        },
        {
          "provenanceKind": "DynamicScan",
          "sourceTool": "CE 7.x debugProcess(Windows) + debug_setBreakpoint(bptWrite)",
          "notes": "OD-RECOVERY-010: probed window changed~1955; CE Windows debugger set 3 write breakpoints (list count 3) under OfflineReplayVerified; overlapping resume pulse hitCount=0; VEH debugProcess stalled. Does not promote any offset."
        },
        {
          "provenanceKind": "DynamicScan",
          "sourceTool": "Host.Web second-pass compare + CE bptWrite",
          "notes": "OD-RECOVERY-011: Watch Offline click required for gate; second-pass Float narrowing ~2899->1929 private-mapping; CE Windows debugger 3 write BPs; hitCount=0 during overlapping resume. Does not promote any offset."
        }
      ],
      "independentProcessLaunches": 0,
      "independentReplays": 0,
      "harnessInvariantsPassed": false,
      "leadApproved": false,
      "decoderAuditorApproved": false
    },
    "playerPositionZ": {
      "status": "Unknown",
      "evidence": [
        {
          "provenanceKind": "DynamicScan",
          "sourceTool": "GameHarness loopback discover-snapshot/compare + discover/pattern",
          "notes": "OD-RECOVERY-004/005/006: controlled offline A->B Float32 [-500,500] narrowing over bounded private/mapped windows; returned candidates addressKind=private-mapping (heap-dynamic pending root). No module-rva/member/pointer-chain root; absolute addresses and values not published."
        },
        {
          "provenanceKind": "GameHarness",
          "sourceTool": "WotBTreader.GameHarness / Host.Web gated scanner",
          "notes": "Sessions discarded after aggregate compare; independentProcessLaunches/Replays remain 0 for promotion. Soft-capped MaxBytes available as of 2026-08-02."
        },
        {
          "provenanceKind": "DynamicScan",
          "sourceTool": "Host.Web discover/pattern ImageRegionsOnly",
          "notes": "OD-RECOVERY-007: 12/12 image-only little-endian absolute pointer AOBs for returned private-mapping survivors returned zero hits. Rules out direct MEM_IMAGE storage of those absolute pointers for this sample; does not promote any offset."
        },
        {
          "provenanceKind": "DynamicScan",
          "sourceTool": "Host.Web discover/pattern absolute LE pointer matrix + CE 7.7 smoke",
          "notes": "OD-RECOVERY-008: windowed Float A->B private-mapping survivors; absolute LE pointer AOB across private/all/image and align 1/8 returned 0 hits; CE x64 launched under OfflineReplayVerified without automated attach/scan. Rules out repeating absolute LE pointer AOB unchanged; does not promote any offset."
        },
        {
          "provenanceKind": "DynamicScan",
          "sourceTool": "Host.Web discover/pattern truncated low32 + CE 7.x debug_setBreakpoint(bptAccess)",
          "notes": "OD-RECOVERY-009: truncated low-32 LE dword AOB of absolute survivors returned 0 hits (priv/img/all). CE attached under OfflineReplayVerified with Windows debugger and 3 access breakpoints; overlapping resume pulse produced 0 hits (no RIP module histogram). Does not promote any offset."
        },
        {
          "provenanceKind": "DynamicScan",
          "sourceTool": "CE 7.x debugProcess(Windows) + debug_setBreakpoint(bptWrite)",
          "notes": "OD-RECOVERY-010: probed window changed~1955; CE Windows debugger set 3 write breakpoints (list count 3) under OfflineReplayVerified; overlapping resume pulse hitCount=0; VEH debugProcess stalled. Does not promote any offset."
        },
        {
          "provenanceKind": "DynamicScan",
          "sourceTool": "Host.Web second-pass compare + CE bptWrite",
          "notes": "OD-RECOVERY-011: Watch Offline click required for gate; second-pass Float narrowing ~2899->1929 private-mapping; CE Windows debugger 3 write BPs; hitCount=0 during overlapping resume. Does not promote any offset."
        }
      ],
      "independentProcessLaunches": 0,
      "independentReplays": 0,
      "harnessInvariantsPassed": false,
      "leadApproved": false,
      "decoderAuditorApproved": false
    },
    "replayTime": {
      "status": "Unknown",
      "evidence": [
        {
          "provenanceKind": "DynamicScan",
          "sourceTool": "Host.Web discover/snapshot+compare Double increased",
          "notes": "OD-RECOVERY-012: offline Float/Double field pivot; replayTime Double increased filter collapsed to 1 private-mapping survivor after controlled resume. Absolute/truncated pointer AOB 0 hits; CE write-BP 0 RIP. Heap-dynamic pending root; offset remains 0; not Candidate/Verified."
        },
        {
          "provenanceKind": "DynamicScan",
          "sourceTool": "Host.Web discover/snapshot+compare Double increased rollingBaseline",
          "notes": "OD-RECOVERY-013: second independent Host.Web-managed process launch reproduced replayTime Double increased behavior; rolling narrow 193>60>15>4 private-mapping. Same replay artifact as OD-012 (independentReplays still 0). Offset remains 0; not Candidate/Verified."
        },
        {
          "provenanceKind": "DynamicScan",
          "sourceTool": "Host.Web discover/snapshot+compare Double increased rollingBaseline",
          "notes": "OD-RECOVERY-015: game-folder .wotbreplay (sha12 0FAE5612491E, import duplicate=True) via managed launch; rolling Double increased completed 882617>...>7 private-mapping under OfflineReplayVerified. File-association alone insufficient for Host gate. independentReplays still 0 (content not proven distinct). Offset remains 0; not Candidate/Verified."
        }
      ],
      "independentProcessLaunches": 3,
      "independentReplays": 0,
      "harnessInvariantsPassed": false,
      "leadApproved": false,
      "decoderAuditorApproved": false
    },
    "playerHP": {
      "status": "Unknown",
      "evidence": [
        {
          "provenanceKind": "DynamicScan",
          "sourceTool": "Host.Web discover/snapshot+compare Int32 unchanged",
          "notes": "OD-RECOVERY-012: Int32 [100,3500] unchanged-during-move pool ~4441 with mapped-mapping sample kinds; secondary HP reconnaissance only; not promoted."
        }
      ],
      "independentProcessLaunches": 0,
      "independentReplays": 0,
      "harnessInvariantsPassed": false,
      "leadApproved": false,
      "decoderAuditorApproved": false
    }
  },
  "confidence": "none",
  "notes": "No usable offsets published for 11.19.0.10. playerYaw Stale. replayTime: OD-012/013/015 show reproducible increased-Double private-mapping survivors across 3 process launches; independentReplays still 0 (BLK-0019). Next OD-RECOVERY-016 interactive root on <=7 set. Offsets remain 0."
}
